{
  "schema_version": "devseek.external-authority-readiness-audit/v1",
  "integrity": {
    "hash_algorithm": "sha256",
    "canonicalization_version": "devseek-canonical-json/v1"
  },
  "audit_id": "DEVSEEK-EXTERNAL-AUTHORITY-READINESS-AUDIT/v1",
  "audit_version": 1,
  "source_status": "generated-readiness-audit-only",
  "integrity_scope": "local-external-authority-readiness-audit",
  "qualification_eligible": false,
  "qualification_effect": "NONE",
  "claims_permitted": false,
  "asserts_gate_pass": false,
  "observation_authority": {
    "semantic_authority": "ExternalAuthorityReadinessAudit",
    "writes_product_state": false,
    "provider_actions": "FORBIDDEN",
    "live_holdout_actions": "FORBIDDEN",
    "runtime_process_observation": "FORBIDDEN",
    "install_or_window_actions": "FORBIDDEN",
    "secret_observation": "FORBIDDEN",
    "request_terminal_state_writes": "FORBIDDEN",
    "qualification_ledger_writes": "FORBIDDEN"
  },
  "source_bindings": {
    "external_authority_requests": {
      "path": "docs/process/devseek-external-authority-requests.json",
      "source_sha256": "ee3686f72dcb051590e8000773178b11f72731f30949a0ac027a3de5d7921aa9",
      "request_set_id": "DEVSEEK-GATE0-EXTERNAL-AUTHORITY-REQUESTS/v1",
      "request_set_sha256": "72366d69ee7e58abe67630d72e16010427470ce509878c537cf6083f616478f4",
      "blocked_requests": 5
    },
    "r4_live_qualification_request_packet": {
      "path": "docs/process/devseek-r4-live-qualification-request-packet.json",
      "source_sha256": "8efb7b899a44b81ab3965e757ec5a38549da4369512a9150f4c2628f6dba4fc7",
      "packet_id": "R4-LIVE-QUALIFICATION-REQUEST-PACKET/v1",
      "packet_sha256": "cbfffa9c37d274471a6a0c58eaf76420e17d36ab329f799a3f31ad71aab977ee",
      "blocked_requests": 5
    },
    "r4_live_user_way_holdout_matrix": {
      "path": "docs/process/devseek-r4-live-user-way-holdout-matrix.json",
      "source_sha256": "000a82523ebeb1047518c7ca32f232d1416cfccf8ec6418599428b642ed783cf",
      "matrix_sha256": "083cfc5a922afe1e571f3d46bc099c0343ff49224c8ae6ae0e461a11d420f38e",
      "blocked_cases": 5
    },
    "r4_real_provider_failure_taxonomy": {
      "path": "docs/process/devseek-r4-real-provider-failure-taxonomy.json",
      "source_sha256": "f600782836dcd78b8050870f72cdee8e5ae8fecfe6eab9e9410edd439e22ed35",
      "taxonomy_sha256": "716ba020f4137ac0565a45ff1ef46aaa63338c07af4aed1d07ed70527798c4c5",
      "categories": 10
    },
    "r4_authorization_and_permission_guide": {
      "path": "docs/process/devseek-r4-authorization-and-permission-guide.md",
      "source_sha256": "826240c4a2cfcae0c6fb1068ed199b1ffed99d64857fd8053d70e3790f40ada5"
    },
    "r4_process_artifacts_aggregate": {
      "path": "docs/process/devseek-r4-process-artifacts-aggregate.json",
      "source_sha256": "6dac45a810f112a5599ccb1347e58c9430c11a49cafe00255184d344cfd6a06e",
      "aggregate_sha256": "6fbef9bfa0f6d83abc5e7cf6c6c803df2b8cabab13ab3716fdce521755fb271e",
      "artifact_errors": 0
    },
    "gate0_decision": {
      "path": "docs/process/devseek-gate0-decision-report.json",
      "source_sha256": "7056371dd94947228a58cf2938347dee554b324071076800f2a6bfc29c0716a8",
      "decision_id": "DEVSEEK-GATE0-INFRASTRUCTURE-DECISION/v1",
      "qualification_status": "NOT_PASSED",
      "external_authority_blockers": 6
    },
    "package_scripts": {
      "path": "package.json",
      "source_sha256": "d31cab51401797bdb7f501f833a396f2fbdf23172e67623025bd9e1180a05ffa",
      "required_script": "verify:external-authority-readiness-audit",
      "required_script_present": true
    },
    "phase_gate_source": {
      "path": "scripts/devseek-phase0-12-verify.mjs",
      "source_sha256": "db927db5c6d2bf78ba78e62075bdde17a39c26ccdb41fef9f1847bd496b48702",
      "required_gate": "external-authority-readiness-audit",
      "required_gate_present": true
    },
    "checker_source": {
      "path": "scripts/devseek-external-authority-readiness-audit-check.mjs",
      "source_sha256": "07bcdf406f21ca21f930a1b84b9a06d24f2a2e94ebb34dd1e61ce76f7a7e6944"
    },
    "oracle_source": {
      "path": "scripts/test/devseek-external-authority-readiness-audit.test.mjs",
      "source_sha256": "2d356a6fe285af4fdc72493e39f88f201b98a9d92a2a27d189d8f4fd1d5af1a5"
    }
  },
  "audit_scope": {
    "families": [
      "Gate0ExternalAuthorityRequest",
      "R4LiveQualificationAuthorization"
    ],
    "request_terminal_states_changed": false,
    "request_terminal_state_writes": false,
    "qualification_ledger_writes": false,
    "local_repository_may_unblock": false,
    "provider_or_window_actions_performed": false,
    "live_rerun_performed": false
  },
  "readiness_boundary": {
    "gate0_status": "NOT_PASSED",
    "gate0_gate_passed": false,
    "gate0_external_authority_blockers": 6,
    "external_authority_trust_anchored": false,
    "r4_live_authorization_blocked": 5,
    "holdout_cases_blocked": 5,
    "live_runs_authorized": 0,
    "approved_live_requests": 0,
    "qualification_claims": 0,
    "process_artifact_errors": 0,
    "local_repository_may_approve_requests": false,
    "markdown_may_change_terminal_state": false
  },
  "request_audits": [
    {
      "request_family": "Gate0ExternalAuthorityRequest",
      "request_id": "EXT-01-SOURCE-REGISTRY-BINDING/request-v1",
      "atomic_id": "EXT-01-SOURCE-REGISTRY-BINDING",
      "decision_owner": "registry-owner",
      "requested_decision": "Approve profile and evidence registry digests, versions, and revocation policy for Gate 0 protected qualification.",
      "terminal_state": "BLOCKED",
      "source_blocker_reason": "external-decision-artifact-not-provided",
      "readiness_status": "BLOCKED_AWAITING_EXTERNAL_AUTHORITY",
      "blocker_precision": "PRECISE",
      "blocker_evidence_fields": [
        "requested_decision_and_scope",
        "required_input_digests",
        "required_artifact_schema_and_signature_purpose",
        "trusted_root_or_registry_reference",
        "repository_import_port_and_fail_closed_verifier",
        "redaction_and_secret_non_observation"
      ],
      "local_repository_may_unblock": false,
      "next_authorization_action": "Obtain an approved external authority artifact for EXT-01-SOURCE-REGISTRY-BINDING from registry-owner, then import it only through the fail-closed external authority adapter.",
      "terminal_state_preserved": true,
      "qualification_effect": "NONE",
      "claims_permitted": false,
      "asserts_gate_pass": false
    },
    {
      "request_family": "Gate0ExternalAuthorityRequest",
      "request_id": "EXT-02-INDEPENDENT-ATTESTATION/request-v1",
      "atomic_id": "EXT-02-INDEPENDENT-ATTESTATION",
      "decision_owner": "independent-attestation-security-authority",
      "requested_decision": "Issue verifiable external authority attestation and trusted root for Gate 0 protected qualification.",
      "terminal_state": "BLOCKED",
      "source_blocker_reason": "external-decision-artifact-not-provided",
      "readiness_status": "BLOCKED_AWAITING_EXTERNAL_AUTHORITY",
      "blocker_precision": "PRECISE",
      "blocker_evidence_fields": [
        "requested_decision_and_scope",
        "required_input_digests",
        "required_artifact_schema_and_signature_purpose",
        "trusted_root_or_registry_reference",
        "repository_import_port_and_fail_closed_verifier",
        "redaction_and_secret_non_observation"
      ],
      "local_repository_may_unblock": false,
      "next_authorization_action": "Obtain an approved external authority artifact for EXT-02-INDEPENDENT-ATTESTATION from independent-attestation-security-authority, then import it only through the fail-closed external authority adapter.",
      "terminal_state_preserved": true,
      "qualification_effect": "NONE",
      "claims_permitted": false,
      "asserts_gate_pass": false
    },
    {
      "request_family": "Gate0ExternalAuthorityRequest",
      "request_id": "EXT-03-PROTECTED-PROFILE-POLICY/request-v1",
      "atomic_id": "EXT-03-PROTECTED-PROFILE-POLICY",
      "decision_owner": "qualification-policy-owner",
      "requested_decision": "Approve protected profile, aggregator allowlist, and exact claim rules for Gate 0.",
      "terminal_state": "BLOCKED",
      "source_blocker_reason": "external-decision-artifact-not-provided",
      "readiness_status": "BLOCKED_AWAITING_EXTERNAL_AUTHORITY",
      "blocker_precision": "PRECISE",
      "blocker_evidence_fields": [
        "requested_decision_and_scope",
        "required_input_digests",
        "required_artifact_schema_and_signature_purpose",
        "trusted_root_or_registry_reference",
        "repository_import_port_and_fail_closed_verifier",
        "redaction_and_secret_non_observation"
      ],
      "local_repository_may_unblock": false,
      "next_authorization_action": "Obtain an approved external authority artifact for EXT-03-PROTECTED-PROFILE-POLICY from qualification-policy-owner, then import it only through the fail-closed external authority adapter.",
      "terminal_state_preserved": true,
      "qualification_effect": "NONE",
      "claims_permitted": false,
      "asserts_gate_pass": false
    },
    {
      "request_family": "Gate0ExternalAuthorityRequest",
      "request_id": "EXT-04-ROLES-KEYS/request-v1",
      "atomic_id": "EXT-04-ROLES-KEYS",
      "decision_owner": "organizational-identity-key-management-authority",
      "requested_decision": "Approve active non-test plan, runner, watchdog, oracle, adjudicator, and aggregator role identities and keys.",
      "terminal_state": "BLOCKED",
      "source_blocker_reason": "external-decision-artifact-not-provided",
      "readiness_status": "BLOCKED_AWAITING_EXTERNAL_AUTHORITY",
      "blocker_precision": "PRECISE",
      "blocker_evidence_fields": [
        "requested_decision_and_scope",
        "required_input_digests",
        "required_artifact_schema_and_signature_purpose",
        "trusted_root_or_registry_reference",